[
  {
    "id": "SMP-00001",
    "data_status": "SAMPLE",
    "source": {
      "localdata_mgtno": null,
      "kakao_place_id": null,
      "google_place_id": null,
      "naver_place_url": null,
      "collected_by": [
        "manual"
      ]
    },
    "name": "종각손칼국수",
    "name_legal": "종각손칼국수",
    "branch": null,
    "status": "영업",
    "zone": "종각",
    "address": {
      "road": "서울특별시 종로구 (샘플 주소 — 실주소 아님)",
      "jibun": null,
      "detail": null
    },
    "coord": {
      "lat": 37.5709,
      "lng": 126.9817
    },
    "phone": null,
    "biz": {
      "license_type": "일반음식점",
      "license_category": "한식",
      "license_date": null
    },
    "purpose_badges": [
      "LUNCH"
    ],
    "categories": [
      "KOR_KALGUKSU"
    ],
    "categories_l1": [
      "KOR"
    ],
    "primary_category": "KOR_KALGUKSU",
    "menus": [
      {
        "name": "바지락칼국수",
        "price": 10000,
        "price_note": null,
        "is_signature": true,
        "category": "KOR_KALGUKSU"
      },
      {
        "name": "들깨칼국수",
        "price": 11000,
        "price_note": null,
        "is_signature": false,
        "category": "KOR_KALGUKSU"
      },
      {
        "name": "왕만두",
        "price": 7000,
        "price_note": null,
        "is_signature": false,
        "category": "KOR_MANDU"
      },
      {
        "name": "겉절이보쌈",
        "price": 18000,
        "price_note": null,
        "is_signature": false,
        "category": "KOR_JOKBAL"
      }
    ],
    "price_range": {
      "lunch_per_person": 11000,
      "dinner_per_person": 14000,
      "level": "₩"
    },
    "facility": {
      "reservation": "NO",
      "reservation_note": null,
      "private_room": "NO",
      "room_capacity_max": null,
      "tabling": "NO",
      "waiting_apps": [
        "현장only"
      ],
      "corkage": "NO",
      "corkage_fee": null,
      "corkage_note": null,
      "group_capacity_max": 12,
      "serves_alcohol": null,
      "parking": "UNKNOWN",
      "takeout": null
    },
    "vibe": {
      "mood": "노포",
      "tags": [
        "가성비",
        "노포",
        "혼밥가능"
      ],
      "note": null
    },
    "waiting": {
      "level": "HIGH",
      "peak_time": "11:50-13:10",
      "note": null
    },
    "hours": {
      "raw": null,
      "lunch_open": true,
      "open": "10:30",
      "close": "21:00",
      "break_time": "15:00-16:30",
      "last_order": "20:20",
      "holiday": "일요일 휴무"
    },
    "distance": {
      "ibk_hq": {
        "meters": 1009,
        "walk_min": 16,
        "straight_m": 747,
        "method": "estimate"
      },
      "ibk_finance_tower": {
        "meters": 1007,
        "walk_min": 16,
        "straight_m": 746,
        "method": "estimate"
      }
    },
    "links": {
      "kakao": null,
      "naver": null,
      "google": null
    },
    "verification": {
      "in_google": null,
      "in_kakao": null,
      "match_score": null,
      "match_method": null,
      "confidence": "LOW"
    },
    "updated_at": "2026-08-26",
    "note": "점심 피크에 웨이팅. 11시 40분 전 도착 권장."
  },
  {
    "id": "SMP-00002",
    "data_status": "SAMPLE",
    "source": {
      "localdata_mgtno": null,
      "kakao_place_id": null,
      "google_place_id": null,
      "naver_place_url": null,
      "collected_by": [
        "manual"
      ]
    },
    "name": "종각커피로스터스",
    "name_legal": "종각커피로스터스",
    "branch": null,
    "status": "영업",
    "zone": "종각",
    "address": {
      "road": "서울특별시 종로구 (샘플 주소 — 실주소 아님)",
      "jibun": null,
      "detail": null
    },
    "coord": {
      "lat": 37.5695,
      "lng": 126.9838
    },
    "phone": null,
    "biz": {
      "license_type": "휴게음식점",
      "license_category": "까페",
      "license_date": null
    },
    "purpose_badges": [
      "CAFE"
    ],
    "categories": [
      "CAF_COFFEE"
    ],
    "categories_l1": [
      "CAF"
    ],
    "primary_category": "CAF_COFFEE",
    "menus": [
      {
        "name": "아메리카노",
        "price": 4500,
        "price_note": null,
        "is_signature": true,
        "category": "CAF_COFFEE"
      },
      {
        "name": "콜드브루",
        "price": 5500,
        "price_note": null,
        "is_signature": false,
        "category": "CAF_COFFEE"
      },
      {
        "name": "플랫화이트",
        "price": 5000,
        "price_note": null,
        "is_signature": false,
        "category": null
      },
      {
        "name": "스콘",
        "price": 4000,
        "price_note": null,
        "is_signature": false,
        "category": "CAF_BAKERY"
      }
    ],
    "price_range": {
      "lunch_per_person": 5500,
      "dinner_per_person": null,
      "level": "₩"
    },
    "facility": {
      "reservation": "NO",
      "reservation_note": null,
      "private_room": "NO",
      "room_capacity_max": null,
      "tabling": "NO",
      "waiting_apps": [
        "현장only"
      ],
      "corkage": "UNKNOWN",
      "corkage_fee": null,
      "corkage_note": null,
      "group_capacity_max": 4,
      "serves_alcohol": false,
      "parking": "UNKNOWN",
      "takeout": null
    },
    "vibe": {
      "mood": "모던",
      "tags": [
        "조용한",
        "1인석",
        "인테리어좋음"
      ],
      "note": null
    },
    "waiting": {
      "level": "LOW",
      "peak_time": "13:00-13:40",
      "note": null
    },
    "hours": {
      "raw": null,
      "lunch_open": true,
      "open": "08:00",
      "close": "21:00",
      "break_time": null,
      "last_order": "20:30",
      "holiday": "연중무휴"
    },
    "distance": {
      "ibk_hq": {
        "meters": 683,
        "walk_min": 11,
        "straight_m": 506,
        "method": "estimate"
      },
      "ibk_finance_tower": {
        "meters": 681,
        "walk_min": 11,
        "straight_m": 504,
        "method": "estimate"
      }
    },
    "links": {
      "kakao": null,
      "naver": null,
      "google": null
    },
    "verification": {
      "in_google": null,
      "in_kakao": null,
      "match_score": null,
      "match_method": null,
      "confidence": "LOW"
    },
    "updated_at": "2026-08-26",
    "note": "식후 커피 수요 몰리는 13시 전후 자리 부족."
  },
  {
    "id": "SMP-00003",
    "data_status": "SAMPLE",
    "source": {
      "localdata_mgtno": null,
      "kakao_place_id": null,
      "google_place_id": null,
      "naver_place_url": null,
      "collected_by": [
        "manual"
      ]
    },
    "name": "종각이자카야 마루",
    "name_legal": "종각이자카야 마루",
    "branch": null,
    "status": "영업",
    "zone": "종각",
    "address": {
      "road": "서울특별시 종로구 (샘플 주소 — 실주소 아님)",
      "jibun": null,
      "detail": null
    },
    "coord": {
      "lat": 37.5712,
      "lng": 126.9836
    },
    "phone": null,
    "biz": {
      "license_type": "일반음식점",
      "license_category": "일식",
      "license_date": null
    },
    "purpose_badges": [
      "DINNER"
    ],
    "categories": [
      "JPN_IZAKAYA"
    ],
    "categories_l1": [
      "JPN"
    ],
    "primary_category": "JPN_IZAKAYA",
    "menus": [
      {
        "name": "모듬사시미",
        "price": 48000,
        "price_note": null,
        "is_signature": true,
        "category": "JPN_IZAKAYA"
      },
      {
        "name": "야키토리 5종",
        "price": 22000,
        "price_note": null,
        "is_signature": false,
        "category": "JPN_IZAKAYA"
      },
      {
        "name": "명란계란말이",
        "price": 14000,
        "price_note": null,
        "is_signature": false,
        "category": "BAR_POCHA"
      },
      {
        "name": "하이볼",
        "price": 8000,
        "price_note": null,
        "is_signature": false,
        "category": "JPN_IZAKAYA"
      }
    ],
    "price_range": {
      "lunch_per_person": null,
      "dinner_per_person": 38000,
      "level": "₩₩₩"
    },
    "facility": {
      "reservation": "YES",
      "reservation_note": "2일 전까지 전화 예약",
      "private_room": "YES",
      "room_capacity_max": 12,
      "tabling": "YES",
      "waiting_apps": [
        "캐치테이블"
      ],
      "corkage": "COND",
      "corkage_fee": 20000,
      "corkage_note": "와인 1병까지 병당 2만원",
      "group_capacity_max": 20,
      "serves_alcohol": true,
      "parking": "UNKNOWN",
      "takeout": null
    },
    "vibe": {
      "mood": "모던",
      "tags": [
        "단체석",
        "접대용",
        "아늑한"
      ],
      "note": null
    },
    "waiting": {
      "level": "LOW",
      "peak_time": null,
      "note": null
    },
    "hours": {
      "raw": null,
      "lunch_open": false,
      "open": "17:00",
      "close": "01:00",
      "break_time": null,
      "last_order": "24:00",
      "holiday": "일요일 휴무"
    },
    "distance": {
      "ibk_hq": {
        "meters": 891,
        "walk_min": 14,
        "straight_m": 660,
        "method": "estimate"
      },
      "ibk_finance_tower": {
        "meters": 873,
        "walk_min": 14,
        "straight_m": 647,
        "method": "estimate"
      }
    },
    "links": {
      "kakao": null,
      "naver": null,
      "google": null
    },
    "verification": {
      "in_google": null,
      "in_kakao": null,
      "match_score": null,
      "match_method": null,
      "confidence": "LOW"
    },
    "updated_at": "2026-08-26",
    "note": "룸 2개 보유, 회식 12인까지."
  },
  {
    "id": "SMP-00004",
    "data_status": "SAMPLE",
    "source": {
      "localdata_mgtno": null,
      "kakao_place_id": null,
      "google_place_id": null,
      "naver_place_url": null,
      "collected_by": [
        "manual"
      ]
    },
    "name": "종각백반집",
    "name_legal": "종각백반집",
    "branch": null,
    "status": "영업",
    "zone": "종각",
    "address": {
      "road": "서울특별시 종로구 (샘플 주소 — 실주소 아님)",
      "jibun": null,
      "detail": null
    },
    "coord": {
      "lat": 37.5688,
      "lng": 126.9824
    },
    "phone": null,
    "biz": {
      "license_type": "일반음식점",
      "license_category": "한식",
      "license_date": null
    },
    "purpose_badges": [
      "LUNCH"
    ],
    "categories": [
      "KOR_BAEKBAN"
    ],
    "categories_l1": [
      "KOR"
    ],